[
  {
    "user_id": "550e8400-e29b-41d4-a716-446655440001",
    "username": "technovator_sam",
    "email": "sam.innovations@gmail.com",
    "password": "hashed_password_123!@#",
    "date_of_birth": "1990-03-22",
    "gender": "Male",
    "bio": "Passionate tech innovator exploring the frontiers of AI and machine learning",
    "profile_picture_url": "https://example.com/profiles/sam.jpg",
    "website": "https://samtech.com",
    "location": "San Francisco, CA",
    "join_date": "2023-05-15T10:30:45Z",
    "followers_count": 1245,
    "following_count": 678,
    "posts_count": 342,
    "is_verified": true
  },
  {
    "user_id": "550e8400-e29b-41d4-a716-446655440002",
    "username": "wanderlust_maya",
    "email": "maya.travels@outlook.com",
    "password": "hashed_password_456$%^",
    "date_of_birth": "1988-07-11",
    "gender": "Female",
    "bio": "Global nomad capturing life's adventures through photography and storytelling",
    "profile_picture_url": "https://example.com/profiles/maya.jpg",
    "website": "https://mayajourney.com",
    "location": "Barcelona, Spain",
    "join_date": "2022-11-03T15:45:22Z",
    "followers_count": 3456,
    "following_count": 1234,
    "posts_count": 567,
    "is_verified": false
  },
  {
    "user_id": "550e8400-e29b-41d4-a716-446655440003",
    "username": "fitness_guru_alex",
    "email": "alex.wellness@protonmail.com",
    "password": "hashed_password_789*&^",
    "date_of_birth": "1995-12-05",
    "gender": "Other",
    "bio": "Fitness coach and nutrition expert helping people transform their lives",
    "profile_picture_url": "https://example.com/profiles/alex.jpg",
    "website": "https://alexfitness.com",
    "location": "Melbourne, Australia",
    "join_date": "2023-01-20T08:15:33Z",
    "followers_count": 2789,
    "following_count": 456,
    "posts_count": 234,
    "is_verified": true
  },
  {
    "user_id": "550e8400-e29b-41d4-a716-446655440004",
    "username": "culinary_artist_emma",
    "email": "emma.cuisine@yahoo.com",
    "password": "hashed_password_012#$%",
    "date_of_birth": "1993-09-18",
    "gender": "Female",
    "bio": "Exploring global cuisines and sharing delectable recipes from around the world",
    "profile_picture_url": "https://example.com/profiles/emma.jpg",
    "website": "https://emmaskitchen.com",
    "location": "Paris, France",
    "join_date": "2022-08-17T13:22:11Z",
    "followers_count": 5678,
    "following_count": 987,
    "posts_count": 456,
    "is_verified": false
  },
  {
    "user_id": "550e8400-e29b-41d4-a716-446655440005",
    "username": "eco_warrior_jake",
    "email": "jake.sustainability@gmail.com",
    "password": "hashed_password_345^&*",
    "date_of_birth": "1987-05-30",
    "gender": "Male",
    "bio": "Environmental activist dedicated to promoting sustainable living and climate action",
    "profile_picture_url": "https://example.com/profiles/jake.jpg",
    "website": "https://jakegreen.org",
    "location": "Vancouver, Canada",
    "join_date": "2023-03-01T17:55:44Z",
    "followers_count": 4567,
    "following_count": 345,
    "posts_count": 289,
    "is_verified": true
  },
  {
    "user_id": "550e8400-e29b-41d4-a716-446655440006",
    "username": "art_curator_sophia",
    "email": "sophia.artworld@artmail.com",
    "password": "hashed_password_678!@#",
    "date_of_birth": "1991-02-14",
    "gender": "Female",
    "bio": "Contemporary art enthusiast connecting artists and art lovers globally",
    "profile_picture_url": "https://example.com/profiles/sophia.jpg",
    "website": "https://sophiaartcurator.com",
    "location": "New York, NY",
    "join_date": "2022-12-10T11:40:55Z",
    "followers_count": 6789,
    "following_count": 1456,
    "posts_count": 678,
    "is_verified": true
  },
  {
    "user_id": "550e8400-e29b-41d4-a716-446655440007",
    "username": "music_producer_kai",
    "email": "kai.soundscape@musicnet.com",
    "password": "hashed_password_901$%^",
    "date_of_birth": "1996-11-07",
    "gender": "Other",
    "bio": "Electronic music producer blending traditional sounds with futuristic beats",
    "profile_picture_url": "https://example.com/profiles/kai.jpg",
    "website": "https://kaimusic.net",
    "location": "Berlin, Germany",
    "join_date": "2023-02-14T20:33:22Z",
    "followers_count": 3210,
    "following_count": 567,
    "posts_count": 345,
    "is_verified": false
  },
  {
    "user_id": "550e8400-e29b-41d4-a716-446655440008",
    "username": "startup_mentor_olivia",
    "email": "olivia.innovation@techmail.com",
    "password": "hashed_password_234*&^",
    "date_of_birth": "1985-06-22",
    "gender": "Female",
    "bio": "Serial entrepreneur and startup mentor helping young innovators turn ideas into reality",
    "profile_picture_url": "https://example.com/profiles/olivia.jpg",
    "website": "https://oliviaventures.com",
    "location": "Singapore",
    "join_date": "2022-09-25T14:15:33Z",
    "followers_count": 7890,
    "following_count": 2345,
    "posts_count": 456,
    "is_verified": true
  },
  {
    "user_id": "550e8400-e29b-41d4-a716-446655440009",
    "username": "marine_biologist_liam",
    "email": "liam.oceanresearch@sciencemail.com",
    "password": "hashed_password_567#$%",
    "date_of_birth": "1992-08-03",
    "gender": "Male",
    "bio": "Marine conservation researcher studying ocean ecosystems and climate impact",
    "profile_picture_url": "https://example.com/profiles/liam.jpg",
    "website": "https://liamoceanproject.org",
    "location": "Cape Town, South Africa",
    "join_date": "2023-04-05T09:22:11Z",
    "followers_count": 2345,
    "following_count": 789,
    "posts_count": 234,
    "is_verified": false
  },
  {
    "user_id": "550e8400-e29b-41d4-a716-446655440010",
    "username": "fashion_designer_zara",
    "email": "zara.couture@fashionnet.com",
    "password": "hashed_password_890^&*",
    "date_of_birth": "1994-01-25",
    "gender": "Female",
    "bio": "Sustainable fashion designer creating eco-friendly and innovative clothing lines",
    "profile_picture_url": "https://example.com/profiles/zara.jpg",
    "website": "https://zaracouture.com",
    "location": "Milan, Italy",
    "join_date": "2022-10-12T16:44:55Z",
    "followers_count": 8901,
    "following_count": 1678,
    "posts_count": 567,
    "is_verified": true
  },
  {
    "user_id": "550e8400-e29b-41d4-a716-446655440002",
    "username": "innovator_alex",
    "email": "alex.innovations@gmail.com",
    "password": "hashed_password_456$%^",
    "date_of_birth": "1988-07-18",
    "gender": "Male",
    "bio": "Innovative tech enthusiast diving deep into emerging technologies and software development",
    "profile_picture_url": "https://example.com/profiles/alex.jpg",
    "website": "https://alextech.com",
    "location": "Seattle, WA",
    "join_date": "2023-05-16T11:45:30Z",
    "followers_count": 1156,
    "following_count": 592,
    "posts_count": 287,
    "is_verified": true
  },
  {
    "user_id": "550e8400-e29b-41d4-a716-446655440003",
    "username": "globetrotter_sophia",
    "email": "sophia.explorer@gmail.com",
    "password": "hashed_password_789#@!",
    "date_of_birth": "1990-03-22",
    "gender": "Female",
    "bio": "Passionate travel writer and cultural enthusiast exploring the world's hidden gems and untold stories",
    "profile_picture_url": "https://example.com/profiles/sophia.jpg",
    "website": "https://sophiaadventures.com",
    "location": "Madrid, Spain",
    "join_date": "2022-12-15T10:30:45Z",
    "followers_count": 2987,
    "following_count": 1098,
    "posts_count": 412,
    "is_verified": false
  },
  {
    "user_id": "550e8400-e29b-41d4-a716-446655440004",
    "username": "wellness_coach_sam",
    "email": "sam.health@gmail.com",
    "password": "hashed_password_987*&^",
    "date_of_birth": "1993-08-15",
    "gender": "Male",
    "bio": "Holistic wellness expert specializing in mind-body transformation techniques",
    "profile_picture_url": "https://example.com/profiles/sam.jpg",
    "website": "https://samwellness.org",
    "location": "Brisbane, Australia",
    "join_date": "2023-02-25T10:30:45Z",
    "followers_count": 2345,
    "following_count": 389,
    "posts_count": 198,
    "is_verified": true
  },
  {
    "user_id": "550e8400-e29b-41d4-a716-446655440005",
    "username": "culinary_explorer_sophia",
    "email": "sophia.gastronomy@gmail.com",
    "password": "hashed_password_345#$%",
    "date_of_birth": "1990-11-25",
    "gender": "Female",
    "bio": "Traveling the world through flavors, documenting unique culinary traditions and innovative cooking techniques",
    "profile_picture_url": "https://example.com/profiles/sophia.jpg",
    "website": "https://sophiascuisine.com",
    "location": "Barcelona, Spain",
    "join_date": "2022-09-22T14:33:22Z",
    "followers_count": 6234,
    "following_count": 1045,
    "posts_count": 512,
    "is_verified": false
  },
  {
    "user_id": "550e8400-e29b-41d4-a716-446655440006",
    "username": "green_planet_alex",
    "email": "alex.eco_solutions@gmail.com",
    "password": "hashed_password_678#$%",
    "date_of_birth": "1990-08-15",
    "gender": "Male",
    "bio": "Climate change researcher passionate about innovative environmental solutions and sustainable technology",
    "profile_picture_url": "https://example.com/profiles/alex.jpg",
    "website": "https://alexgreen.org",
    "location": "Toronto, Canada",
    "join_date": "2023-04-15T14:30:22Z",
    "followers_count": 3845,
    "following_count": 412,
    "posts_count": 256,
    "is_verified": true
  },
  {
    "user_id": "550e8400-e29b-41d4-a716-446655440007",
    "username": "art_explorer_olivia",
    "email": "olivia.artworld@creativeemail.com",
    "password": "hashed_password_789$%^",
    "date_of_birth": "1993-04-22",
    "gender": "Female",
    "bio": "Modern art curator passionate about emerging artists and global art movements",
    "profile_picture_url": "https://example.com/profiles/olivia.jpg",